### ISSUE TITLE
useHeadersForUrl needed to be set to false when public Host header is not forwarded by reverse proxy (expected)

### ISSUE THREAD

**Issue by e-koukel** [ERDDAP/erddap#457]
**Describe the bug**
<useHeadersForUrl> feature flag had to be set to false (as opposed to the default true) when our ERDDAP was behind a proxy. The baseUrl and baseHttpsUrl were both set to the public URL base, but when the default setting for useHeadersForUrl was true, the links provided to the client were to the internal URL. This happened across multiple ERDDAPs.

**Expected behavior**
Any link including the ERDDAP URL (for example, List of All Datasets) should be able to be followed when using a proxy. 

**Server**
- The ERDDAP is on version 2.30.0, tomcat 10.1.53, and Java 25.0.2, on Linux.

**Comment by srstsavage** [comment]
Hello, are you setting the `Host` ~~and `X-Forwarded-Proto`~~ headers in your proxy?

https://erddap.github.io/docs/server-admin/deploy-install?_highlight=nginx#nginx

Can you please share which web server you're using for proxying and whether you're setting the proper proxy related headers?

**Comment by rmendels** [comment]
@e-koukel @srstsavage   Yes,  I don't think this an ERDDAP™ issue per se,  but perhaps we need more documentation on how certain settings in ERDDAP™ interact with proxying.  I proxy to all sorts of things with no problems.  So yes,  send you setup info.

**Comment by e-koukel** [comment]
@srstsavage @rmendels We don't technically have a proxy, we have a Kemp load balancer / firewall device. Host and X-Forwarded-For are set, but not X-Forwarded-Proto, so maybe that will fix things. We'll try that when the person in charge of that aspect comes back into the office. 
We're in the middle of changing machines, and I don't believe we've had to adjust any of these settings when we've changed machines before (though I could be wrong).

**Comment by rmendels** [comment]
@e-koukel I think the main point is ERDDAP™ doesn't really know proxies,  It knows how to create a URL based on your different settings in setup.xml and sends that URL.  If the URL does not directly send to a tomcat,  then it is an issue of properly setting up not just apache,  but often how the tomcat port is defined.

**Comment by srstsavage** [comment]
Thank you for the additional info. 

> Host and X-Forwarded-For are set, but not X-Forwarded-Proto

> when the default setting for useHeadersForUrl was true, the links provided to the client were to the internal URL

These two statements make me wonder. If `Host` is getting to ERDDAP but not `X-Forwarded-Proto` I would expect that the generated links would contain the correct public facing hostname but the wrong proto (usually an http URL instead of https).

Sounds good on checking with the load balancer admin on the forwarded headers. In the meantime, I'm glad you found the `useHeadersForUrl` feature flag.

**Comment by rmendels** [comment]
@e-koukel What are you settings in server.xml for the port you are proxying to?

**Comment by lkamb** [comment]
It seems there is some difference in the forwarding rules between the two machines.
On the "old" machine, the Host: header gives the external, public host name.
On the "new" machine, the Host: header is the internal, actual host name.
In both cases, X-Forwarded-For is correctly the IP address of the calling computer.

On the old machine, with no mention of useHeadersForUrl, (it therefore being true), I presume erddap was building the correct public URL from the Host: header.   Although I'm not quite sure how it's getting the proper protocol (https:). (Maybe it's picking it up from the baseUrl property??) We have had rules where the load-balancer rewrites outgoing URLs, but in this case I'm looking at the network traffic on the internal machine, and the redirect header has it right. (I start out with a request to just /erddap, so there is a redirect to /erddap/index.html)

On the new machine, with useHeadersForUrl=True, the redirect is to the internal host URL.  With useHeaders=False (explicit), then the redirect is correct.

Both systems are running 2.30.0

So, it's working with the useHeadersForUrl=False, so all good I think.  Maybe a little more clue about the useHeadersForUrl property would be good.

And just to be clear: this isn't a true "proxy" situation, it's a reverse-proxy I guess.  My bad for being loose with terminology.

If you want packet logs, I can send them.

**Comment by rmendels** [comment]
@lkamb Thanks for the info.  What would be helpful is if you can provide how the two baseURLs are defined in the setup.xml file,  the complete set of commands used in the proxying (only that us needed),  and also what file that is in,  as well the port definition(s) in the tomcat server.xml.  We have several ERDDAP™s that successful proxy using  useHeadersForUrl=True as the setting,  when that was first implemented in took me a little while to get all the parts set up correctly,  but those are the three places that matter.

**Comment by rmendels** [comment]
@lkamb I forgot, are you doing an internal proxy (ie tomcat and Apache2 or nginx are on the same machine),  or a proxy to another machine,  that is Apache2 and tomcat are on a different machine.

**Comment by srstsavage** [comment]
> On the "new" machine, the Host: header is the internal, actual host name.

There's our culprit. With `useHeadersForUrl` enabled the `Host` header is used to build the URLs returned to the client, so in this case the URLs will use the internal host name (since that's what the `Host` header contains). If you can find a way to set the `Host` header to the external public hostname when reverse proxying to the new machine (~~and also `X-Forwarded-Proto`~~), `useHeadersForUrl` should work as expected. Although, as you mentioned you can just fall back to the legacy behavior by disabling `useHeadersForUrl` and making sure `baseUrl` and `baseHttpsUrl` are set.

 Here are the two relevant functions from the ERDDAP source for transparency (`baseUrl` and `getHostAndPathFromRequest` methods):

https://github.com/ERDDAP/erddap/blob/d8d9e23d28040e82353dc599aa9bdd8be55b1e34/WEB-INF/classes/gov/noaa/pfel/erddap/util/EDStatic.java#L928-L953

**Comment by lkamb** [comment]
@rmendels : 
- On both machines, both the baseUrl and baseHttpUrl elements are specified as https://data.pmel.noaa.gov/<service_name>
   Except when changed to the local host and port for doing internal testing.  
   I figure this is the case that would be made unnecessary if the setting of the Host: header was done properly and consistently.
- In server.xml, the only port specified is the http connection (listening) port, which is of course different for each service tomcat.
- The forwarding rules are specified on the Kemp firewall/load-balancer device.  I unfortunately do not have direct access to that or to those rules.  I will hopefully go through those in detail with the network guy today, time permitting.
- Our setup is tomcat server in DMZ, fronted by the publicly accessible firewall/load-balancer on a separate dedicated machine.   No apache or nginx involved.  Yes I know you strongly recommend using one of them.

@srstsavage : 
- Agreed.
- I note that you ask about X-Forwarded-Proto, but there is no reference to that in EDstatic, only -For and -Prefix
  So I am still a little unclear how, on the old machine, with Host: set to data.pmel.noaa.gov, but no X-Forwarded-Proto (or -Prefix) set, and the HttpServletRequest object at the internal server would have scheme() defined as http: (At least that's what I would expect. TLS is all handled by the firewall/load-balancer, so all internal requests are http:)*, how we get https://data.pmel.noaa.gov/<service> as the base of the returned redirect location and all embedded links.

* I do note that there is one reference to https: in the Via: header.

All that being said, it is working, basically as expected (with the scheme question still outstanding), so I don't know how much, if any, further effort we want to put into this.  I'm happy to keep investigating if you all want.

Below are (lightly edited) headers from the "old" machine.

Original request:
16:19:23.198925 IP loadmaster-41gw.pmel.noaa.gov.27269 > smokey.8505: Flags [.], seq 4003907674:4003909134, ack 3302833684, win 229, length 1460
E...`.@.@.?..7) .7).j.!9...Z..>.P...B&..GET /erddap HTTP/1.1
Host: data.pmel.noaa.gov
User-Agent: Mozilla/5.0 (Macintosh; Intel Mac OS X 10.15; rv:150.0) Gecko/20100101 Firefox/150.0
Accept: text/html,application/xhtml+xml,application/xml;q=0.9,*/*;q=0.8
Accept-Language: en-US,en;q=0.9
Accept-Encoding: gzip, deflate, br, zstd
Connection: keep-alive
Cookie: _[cookie garbage]
16:19:23.198977 IP loadmaster-41gw.pmel.noaa.gov.27269 > smokey.8505: Flags [P.], seq 1460:3986, ack 1, win 229, length 2526
[... more garbage]
Upgrade-Insecure-Requests: 1
Sec-Fetch-Dest: document
Sec-Fetch-Mode: navigate
Sec-Fetch-Site: none
Sec-Fetch-User: ?1
Priority: u=0, i
Pragma: no-cache
Cache-Control: no-cache
Via: HTTPS/1.1 161.55.85.36:443
X-Forwarded-For: 137.75.81.238
X-Forwarded-For-Port: 65479

Response:
16:19:23.202556 IP smokey.8505 > loadmaster-41gw.pmel.noaa.gov.27269: Flags [P.], seq 1:184, ack 3986, win 291, length 183
E.....@.@.#..7)..7) !9j...>.....P..#.a..HTTP/1.1 302
Location: https://data.pmel.noaa.gov/socat/erddap/index.html
Content-Length: 0
Date: Tue, 28 Apr 2026 23:19:23 GMT
Keep-Alive: timeout=20
Connection: keep-alive

following redirected request:
16:19:23.276700 IP loadmaster-41gw.pmel.noaa.gov.27269 > smokey.8505: Flags [P.], seq 3986:7983, ack 184, win 237, length 3997
E...`.@.@.5..7) .7).j.!9......>.P....G..GET /erddap/index.html HTTP/1.1
Host: data.pmel.noaa.gov
User-Agent: Mozilla/5.0 (Macintosh; Intel Mac OS X 10.15; rv:150.0) Gecko/20100101 Firefox/150.0
Accept: text/html,application/xhtml+xml,application/xml;q=0.9,*/*;q=0.8
Accept-Language: en-US,en;q=0.9
Accept-Encoding: gzip, deflate, br, zstd
Connection: keep-alive
Cookie: _[..cookie garbage]
Upgrade-Insecure-Requests: 1
Sec-Fetch-Dest: document
Sec-Fetch-Mode: navigate
Sec-Fetch-Site: none
Sec-Fetch-User: ?1
Priority: u=0, i
Pragma: no-cache
Cache-Control: no-cache
Via: HTTPS/1.1 161.55.85.36:443
X-Forwarded-For: 137.75.81.238
X-Forwarded-For-Port: 65479

**Comment by lkamb** [comment]
One correction:

The returned base URL is actually https://data.pmel.noaa.gov/<service_name>  (/socat in the example).  That bit is stripped from the internal request.  This presumably would be in the X-Forwarded-Prefix header.

This is what is specified in the <baseUrl> element.  And to reiterate, the <useHeadersForUrl> element is not present in the setup.xml for this example from the "old" machine.

**Comment by srstsavage** [comment]
@lkamb Ah, yes you're correct about `X-Forwarded-Proto`, my mistake.

> I note that you ask about X-Forwarded-Proto, but there is no reference to that in EDstatic, only -For and -Prefix
So I am still a little unclear how, on the old machine, with Host: set to data.pmel.noaa.gov, but no X-Forwarded-Proto (or -Prefix) set, and the HttpServletRequest object at the internal server would have scheme() defined as http: (At least that's what I would expect. TLS is all handled by the firewall/load-balancer, so all internal requests are http:)*, how we get https://data.pmel.noaa.gov/ as the base of the returned redirect location and all embedded links.

If `useHeadersForUrl` is active then the request protocol is examined to determine the protocol of the constructed URL, so no need to set `X-Forwarded-Proto`.

**Comment by rmendels** [comment]
@lkamb @e-koukel @srstsavage   Ok I am pretty certain the problem is here:

 https://data.pmel.noaa.gov/socat/erddap/index.html

This is an known "issue" if you want with the useHeadersForUrl feature flag, it assumes something like:

https://data.pmel.noaa.gov/erddap

The solution is to put in the proxy statement  (well I think it is because I don't totally understand how your device works, I know Apache2 and nginx a little but this is what works on Apache2):

RequestHeader set X-Forwarded-Prefix  /socat/erddap

Give that a try and let us know.  And thanks for putting the time into this,  we first want to make certain if there is a bug on our end,  and second to try to help people with their setups as much as possible.

**Comment by srstsavage** [comment]
I believe `X-Forwarded-Prefix` would need to be set to `/socat` here, as the `/erddap` portion gets appended later.

> All that being said, it is working, basically as expected (with the scheme question still outstanding), so I don't know how much, if any, further effort we want to put into this.

Agreed, and thanks for providing info here. I think generally things are working as intended:

* When `useHeaderForUrl` is enabled (default), reverse proxy setups need to have proper `Host` header forwarding set up (and `X-Forwarded-Prefix` if hosting on a path other than `erddap`).
* For complex reverse proxy setups where it's not possible to set those headers, users should set `useHeaderForUrl` to false and make sure `baseUrl` and `baseHttpsUrl` are set.

I thnk the action item for ERDDAP devs is to improve the server admin documentation in this regard.

**Comment by rmendels** [comment]
@srstsavage   "I thnk the action item for ERDDAP devs is to improve the server admin documentation in this regard."  Absolutely  agree.  That was in my original comment and why I wanted to find out what was happening and possible solutions.
